{

  "$schema": "../schemas/scholar_browser_patterns.v1.schema.json",

  "schema_version": "scholar_browser_patterns.v1",

  "generated_at": "2026-05-26",

  "policy": {

    "default_route": "reference-fulltext-acquisition",

    "allowed_role": "Browser-visible academic search pages may be used as candidate sensors, full-text link sensors, citation-chain sensors, and metadata-export sensors under the unified full-text acquisition and evidence verification workflow.",

    "forbidden_role": "They must not become an independent citation verifier, Zotero writer, paywall bypass, captcha bypass, cookie exporter, or high-frequency scraper.",

    "must_stop_for": [

      "captcha",

      "login_required",

      "sms_or_account_challenge",

      "institutional_access_required",

      "download_permission_missing",

      "source_identity_mismatch"

    ]

  },

  "systems": [

    {

      "system_id": "cnki",

      "upstream": "cookjohn/cnki-skills",

      "repo_url": "https://github.com/cookjohn/cnki-skills",

      "decision": "adapt",

      "absorbed_into": [

        "skills/scripts/envctl/cnki_zotero.py",

        "skills/catalog/cnki_zotero_workflow.json",

        "skills/plugins/research-autopilot/skills/reference-fulltext-acquisition",

        "skills/plugins/research-autopilot/skills/research-autopilot"

      ],

      "accepted_patterns": [

        "single async DOM script per browser operation where feasible",

        "direct navigation to detail pages instead of clicking result links that spawn extra tabs",

        "old-style advanced search page for source category filters",

        "author plus affiliation fields before author-institution downloads",

        "visible Tencent captcha detection by #tcaptcha_transform_dy position",

        "result-table checkbox value as export metadata id",

        "batch export metadata from search results before Zotero planning",

        "journal indexing lookup as a candidate quality signal"

      ],

      "rejected_patterns": [

        "copying Claude slash-command skills into the local Codex runtime",

        "direct Zotero write before local import plan review",

        "saving browser cookies or login state",

        "using CNKI export metadata as DOI verification",

        "downloading before author-affiliation evidence is present",

        "bypassing login, captcha, paywall, or institutional access restrictions"

      ],

      "entry_urls": [

        "https://kns.cnki.net/kns8s/search",

        "https://kns.cnki.net/kns/AdvSearch?classid=7NS01R8M",

        "https://navi.cnki.net/knavi"

      ],

      "primary_keys": [

        "input.cbItem value as cnki_export_id",

        "detail_url from td.name a.fz14",

        "dbcode/dbname/filename when a detail page exposes them",

        "title plus source plus year for fallback matching"

      ],

      "captcha_detection": [

        "#tcaptcha_transform_dy exists and getBoundingClientRect().top >= 0",

        "page title or URL indicates security verification",

        "visible text contains a slider verification instruction"

      ],

      "local_smoke_test": {

        "tested_at": "2026-05-26",

        "environment": "Active VELA runtime repository, Playwright MCP browser smoke only, no source-file writes, no full-text download, no Zotero write.",

        "result": "pass",

        "passed_checks": [

          "CNKI basic search page loaded after visible security gate cleared in the session.",

          "Basic search selectors input.search-input and input.search-btn returned structured result rows.",

          "Result extraction returned title, href, authors, journal, date, download count, and input.cbItem export ids.",

          "Old-style advanced search URL exposed #txt_1_value1 and source-category checkboxes #SCI, #EI, #hx, #CSSCI, #CSCD, #gjAll.",

          "CSSCI advanced search for 社会资本 returned result count and rows with no automated download."

        ],

        "blocked_checks": [

          "Actual PDF or CAJ download was not run in this smoke because it would acquire copyrighted full text.",

          "Zotero push scripts were not used; Zotero writes remain behind ingest-plan and explicit import."

        ],

        "not_tested_checks": [

          "High-volume batch download throughput.",

          "User-side slider completion followed by resume in the same run."

        ]

      },

      "result_fields": [

        {

          "name": "title",

          "selector": "td.name a.fz14",

          "purpose": "candidate title and detail-page navigation",

          "required": true

        },

        {

          "name": "cnki_export_id",

          "selector": ".result-table-list tbody input.cbItem",

          "purpose": "batch metadata export from results page",

          "required": false

        },

        {

          "name": "authors",

          "selector": "td.author a.KnowledgeNetLink",

          "purpose": "candidate authors and author gate",

          "required": true

        },

        {

          "name": "source",

          "selector": "td.source a",

          "purpose": "journal or source matching",

          "required": false

        },

        {

          "name": "published_at",

          "selector": "td.date",

          "purpose": "year/date matching",

          "required": false

        },

        {

          "name": "citation_count",

          "selector": "td.quote",

          "purpose": "sort and screening signal, not formal quality proof",

          "required": false

        },

        {

          "name": "download_count",

          "selector": "td.download",

          "purpose": "screening signal only",

          "required": false

        },

        {

          "name": "detail_affiliations",

          "selector": ".brief h3.author:nth-of-type(2) a",

          "purpose": "author-affiliation evidence before restricted downloads",

          "required": false

        }

      ],

      "actions": [

        {

          "id": "basic_search",

          "purpose": "Find CNKI candidates by subject, keyword, title, author, affiliation, fulltext, or DOI.",

          "method": "direct_cdp",

          "selectors_or_params": [

            "korder=SU",

            "korder=KY",

            "korder=TI",

            "korder=AU",

            "korder=AF",

            "korder=FT",

            "korder=DOI"

          ],

          "notes": [

            "Use envctl cnki-zotero find or fetch instead of standalone slash commands.",

            "Downloaded files must go to the active project outputs/inbox/cnki-downloads when a project root exists."

          ]

        },

        {

          "id": "advanced_search_with_source_category",

          "purpose": "Filter Chinese candidates by field, date, source category, author, journal, and author affiliation.",

          "method": "navigate_plus_evaluate_script",

          "selectors_or_params": [

            "#txt_1_value1",

            "#au_1_value1",

            "#au_1_value2",

            "#magazine_value1",

            "#SCI",

            "#EI",

            "#hx",

            "#CSSCI",

            "#CSCD",

            "#startYear",

            "#endYear"

          ],

          "notes": [

            "The old-style advanced search URL is required when source category checkboxes are needed.",

            "For author plus institution requests, author-only search is not sufficient."

          ]

        },

        {

          "id": "detail_metadata",

          "purpose": "Read full candidate metadata, abstract, keywords, fund, classification, DOI, and affiliation text.",

          "method": "direct_cdp",

          "selectors_or_params": [

            ".brief h1",

            ".brief h3.author",

            ".abstract-text",

            "p.keywords",

            "p.funds",

            ".clc-code",

            "#pdfDown",

            "#cajDown"

          ],

          "notes": [

            "Detail-page evidence can satisfy the author-affiliation gate.",

            "DOI found on the page must still be verified by the citation gate before formal writing."

          ]

        },

        {

          "id": "authorized_download",

          "purpose": "Trigger PDF or CAJ downloads only in the user's already-authorized browser session.",

          "method": "direct_cdp",

          "selectors_or_params": [

            "#pdfDown",

            ".btn-dlpdf a",

            "#cajDown",

            ".btn-dlcaj a",

            ".downloadlink.icon-notlogged"

          ],

          "notes": [

            "Do not persist cookies.",

            "Stop on visible captcha, login failure, or missing permission.",

            "Use referrer-preserving browser navigation where direct URL navigation is required."

          ]

        },

        {

          "id": "batch_export_metadata",

          "purpose": "Collect CNKI export metadata from the result page without visiting every detail page.",

          "method": "metadata_export_only",

          "selectors_or_params": [

            "https://kns.cnki.net/dm8/API/GetExport",

            "input.cbItem",

            "displaymode=GBTREFER,elearning,EndNote",

            "uniplatform=NZKPT"

          ],

          "notes": [

            "Exported metadata is a Zotero planning input, not final citation verification.",

            "Use local import plans before any Zotero write."

          ]

        },

        {

          "id": "journal_index_lookup",

          "purpose": "Check journal inclusion labels and basic evaluation fields for Chinese venue screening.",

          "method": "navigate_plus_evaluate_script",

          "selectors_or_params": [

            "h3.titbox",

            "ISSN",

            "CN",

            "复合影响因子",

            "综合影响因子",

            "北大核心",

            "CSSCI",

            "CSCD",

            "SCI",